{
  "version": 1,
  "definicion": "Un ticket está listo para un agente si alguien ajeno al equipo podría completarlo sin preguntar.",
  "listoDesde": 4,
  "criterios": {
    "contenido": {
      "nombre": "Descripción con contenido",
      "como": "La descripción tiene al menos 40 palabras y no se limita a repetir el título.",
      "minimoPalabras": 40
    },
    "criterios": {
      "nombre": "Criterios de aceptación",
      "como": "Hay una sección o un patrón reconocible: criterios de aceptación, dado / cuando / entonces, lista con casillas o frases que empiezan por debe / no debe.",
      "patrones": [
        { "patron": "criterios? de aceptacion|acceptance criteria|definicion de hecho|definition of done" },
        { "patron": "\\b(dado|given)\\b[\\s\\S]{0,300}?\\b(cuando|when)\\b[\\s\\S]{0,300}?\\b(entonces|then)\\b" },
        { "patron": "^\\s*[-*]?\\s*\\[( |x)\\]", "flags": "m" },
        { "patron": "^\\s*[-*]?\\s*(el sistema |la aplicacion |la app )?(no )?(debe|must|should)\\b", "flags": "m" }
      ]
    },
    "acotado": {
      "nombre": "Alcance acotado",
      "como": "No es una épica y su estimación (o su duración, si no tiene estimación) no pasa del límite.",
      "maximoEstimacion": 5,
      "maximoDias": 5
    },
    "referencias": {
      "nombre": "Referencias",
      "como": "Tiene al menos un enlace, una clave de otro ticket, un adjunto o una ruta de código o de diseño.",
      "patrones": [
        { "patron": "\\b[A-Z][A-Z0-9]{1,9}-\\d+\\b", "sobreOriginal": true },
        { "patron": "https?://" },
        { "patron": "\\b[\\w.-]+/[\\w./-]+\\.[a-z0-9]{1,5}\\b" }
      ]
    },
    "sinDependencias": {
      "nombre": "Sin dependencias abiertas",
      "como": "No está bloqueado y no dice que depende de otra cosa o que está bloqueado por algo.",
      "patrones": [
        { "patron": "\\b(depende de|dependemos de|bloquead[oa] por|a la espera de|pendiente de que|blocked by|depends on|waiting for)\\b" }
      ]
    }
  }
}
